<!--
    ********USUARIO********
    *tipo = Se refiere al tipo de usuario.
            -Administrador 1
            -Profesor 2
            -Alumno 3
            
    *nombre = Cadena que contiene el Nombre del usuario. Conformado por:
              Nombre, Apellido Paterno, Apellido Materno
    
    *usuario = Cadena que contiene el Nombre para identificarlo como usuario
    
    *contrasena = Cadena que contiene la constraseÃ±a que crea el usuario al registrarse
             
-->

<xs:schema xmlns:xs="http://www.w3.org/2001/XMLSchema">
    <xs:element name="raiz">   
        <xs:element name="USUARIO">
            <xs:complexType>
                <xs:all>
                    <xs:element name="nombre" type="xs:string"/>
                    <xs:element name="usuario" type="xs:string"/>
                    <xs:element name="contrasena" type="xs:string"/>
                </xs:all>
                <xs:attribute name="id" use="required"/>
                <xs:attribute name="tipo" use="required"/>
            </xs:complexType>
        </xs:element>
    </xs:element>
</xs:schema>





